,Name,Trait1,Trait2,Trait3,Trait4,Trait5,Trait6,Trait7
125,Giant Octopus,"Hold Breath: While out of water, the Octopus can hold its breath for 1 hour.",Underwater Camouflage: The Octopus has advantage on Dexterity (Stealth) checks made while Underwater.,Water Breathing: The Octopus can breathe only Underwater.,,,,
126,Giant Spider,"Spider Climb: The Spider can climb difficult surfaces, including upside down on ceilings, without needing to make an ability check.","Web Sense: While in contact with a web, the Spider knows the exact location of any other creature in contact with the same web.",Web Walker: The Spider ignores Movement restrictions caused by webbing.,,,,
127,Giant Toad,Amphibious: The toad can breathe air and water,"Standing Leap: The toad's long jump is up to 20 ft. and its high jump is up to 10 ft., with or without a running start.",,,,,
128,Giant Vulture,Keen Sight and Smell: The Vulture has advantage on Wisdom (Perception) checks that rely on sight or smell.,Pack Tactics: The Vulture has advantage on an Attack roll against a creature if at least one of the vulture's allies is within 5 ft. of the creature and the ally isn't Incapacitated.,,,,,
129,Harpy,,,,,,,
130,Hippogriff,Keen Sight: The hippogriff has advantage on Wisdom (Perception) checks that rely on sight.,,,,,,
131,Imp,"Shapechanger: The imp can use its action to Polymorph into a beast form that resembles a rat (speed 20 ft.), a raven (20 ft., fly 60 ft.), or a Spider (20 ft., climb 20 ft.), or back into its true form. Its Statistics are the same in each form, except for the speed changes noted. Any Equipment it is wearing or carrying isn't transformed. It reverts to its true form if it dies.",Devil's Sight: Magical Darkness doesn't impede the imp's Darkvision.,Magic Resistance: The imp has advantage on saving throws against Spells and other magical effects.,"Variant: Familiar: The imp can enter into a contract to serve another creature as a familiar, forming a Telepathic Bond with its willing master. While the two are bonded, the master can sense what the imp senses as long as they are within 1 mile of each other. While the imp is within 10 feet of its master, the master shares the imp’s Magic Resistance trait. If its master violates the terms of the contract, the imp can end its service as a familiar, ending the Telepathic Bond.",,,
132,Lion,Keen Smell: The lion has advantage on Wisdom (Perception) checks that rely on smell.,Pack Tactics: The lion has advantage on an Attack roll against a creature if at least one of the lion's allies is within 5 ft. of the creature and the ally isn't Incapacitated.,"Pounce: If the lion moves at least 20 ft. straight toward a creature and then hits it with a claw Attack on the same turn, that target must succeed on a DC 13 Strength saving throw or be knocked prone. If the target is prone, the lion can make one bite Attack against it as a Bonus Action.","Running Leap: With a 10-foot running start, the lion can long jump up to 25 ft..",,,
133,Quasit,"Shapechanger: The quasit can use its action to Polymorph into a beast form that resembles a bat (speed 10 ft. fly 40 ft.), a centipede (40 ft., climb 40 ft.), or a toad (40 ft., swim 40 ft.), or back into its true form . Its Statistics are the same in each form, except for the speed changes noted. Any Equipment it is wearing or carrying isn't transformed . It reverts to its true form if it dies.",Magic Resistance: The quasit has advantage on saving throws against Spells and other magical effects.,"Variant: Familiar: The quasit can serve another creature as a familiar, forming a Telepathic Bond with its willing master. While the two are bonded, the master can sense what the quasit senses as long as they are within 1 mile of each other. While the quasit is within 10 feet of its master, the master shares the quasit's Magic Resistance trait. At any time and for any reason, the quasit can end its service as a familiar, ending the Telepathic Bond.",,,,
134,Specter,Incorporeal Movement: The specter can move through other creatures and Objects as if they were difficult terrain. It takes 5 (1d10) force damage if it ends its turn inside an object.,"Sunlight Sensitivity: While in sunlight, the specter has disadvantage on Attack rolls, as well as on Wisdom (Perception) checks that rely on sight.",,,,,
135,Spy,"Cunning Action: On each of its turns, the spy can use a Bonus Action to take the Dash, Disengage, or Hide action.","Sneak Attack (1/Turn): The spy deals an extra 7 (2d6) damage when it hits a target with a weapon Attack and has advantage on the Attack roll, or when the target is within 5 ft. of an ally of the spy that isn't Incapacitated and the spy doesn't have disadvantage on the Attack roll.",,,,,
136,Swarm of Quippers,Blood Frenzy: The swarm has advantage on melee Attack rolls against any creature that doesn't have all its hit points.,"Swarm: The swarm can occupy another creature's space and vice versa, and the swarm can move through any opening large enough for a Tiny Quipper. The swarm can't regain hit points or gain Temporary Hit Points.",Water Breathing: The swarm can breathe only Underwater.,,,,
137,Tiger,Keen Smell: The tiger has advantage on Wisdom (Perception) checks that rely on smell.,"Pounce: If the tiger moves at least 20 ft. straight toward a creature and then hits it with a claw Attack on the same turn, that target must succeed on a DC 13 Strength saving throw or be knocked prone. If the target is prone, the tiger can make one bite Attack against it as a Bonus Action.",,,,,
138,Ankheg,,,,,,,
139,Awakened Tree,"False Appearance: While the tree remains motionless, it is indistinguishable from a normal tree.",,,,,,
140,Azer,Heated Body: A creature that touches the azer or hits it with a melee Attack while within 5 ft. of it takes 5 (1d10) fire damage.,"Heated Weapons: When the azer hits with a metal melee weapon, it deals an extra 3 (1d6) fire damage (included in the attack).",Illumination: The azer sheds bright light in a 10-foot radius and dim light for an additional 10 ft..,,,,
141,Bandit Captain,,,,,,,
142,Berserker,"Reckless: At the start of its turn, the berserker can gain advantage on all melee weapon Attack rolls during that turn, but Attack rolls against it have advantage until the start of its next turn.",,,,,,
143,Black Dragon Wyrmling,Amphibious: The dragon can breathe air and water.,,,,,,
144,Bronze Dragon Wyrmling,Amphibious: The dragon can breathe air and water.,,,,,,
145,Centaur,"Charge: If the centaur moves at least 30 ft. straight toward a target and then hits it with a pike Attack on the same turn, the target takes an extra 10 (3d6) piercing damage.",,,,,,
146,Cult Fanatic,Dark Devotion: The fanatic has advantage on saving throws against being Charmed or Frightened.,"Spellcasting: The fanatic is a 4th-level spellcaster. Its spell casting ability is Wisdom (spell save DC 11, +3 to hit with spell attacks). The fanatic has the following Cleric Spells prepared: ",,,,,
147,Druid,"Spellcasting: The druid is a 4th-level spellcaster. Its spellcasting ability is Wisdom (spell save DC 12, +4 to hit with spell attacks). It has the following druid Spells prepared: ",,,,,,
148,Ettercap,"Spider Climb: The ettercap can climb difficult surfaces, including upside down on ceilings, without needing to make an ability check.","Web Sense: While in contact with a web, the ettercap knows the exact location of any other creature in contact with the same web.",Web Walker: The ettercap ignores Movement restrictions caused by webbing.,,,,
149,Gargoyle,"False Appearance: While the gargoyle remains motion less, it is indistinguishable from an inanimate statue.",,,,,,
150,Gelatinous Cube,"Ooze Cube: The cube takes up its entire space. Other creatures can enter the space, but a creature that does so is subjected to the cube's Engulf and has disadvantage on the saving throw.","Transparent: Even when the cube is in plain sight, it takes a successful DC 15 Wisdom (Perception) check to spot a cube that has neither moved nor attacked. A creature that tries to enter the cube's space while unaware of the cube is surprised by the cube.",,,,,
151,Ghast,"Stench: Any creature that starts its turn within 5 ft. of the ghast must succeed on a DC 10 Constitution saving throw or be Poisoned until the start of its next turn. On a successful saving throw, the creature is immune to the ghast's Stench for 24 hours.",Turn Defiance: The ghast and any Ghouls within 30 ft. of it have advantage on saving throws against effects that turn Undead.,,,,,
152,Giant Boar,"Charge: If the boar moves at least 20 ft. straight toward a target and then hits it with a tusk Attack on the same turn, the target takes an extra 7 (2d6) slashing damage. If the target is a creature, it must succeed on a DC 13 Strength saving throw or be knocked prone.","Relentless (Recharges after a Short or Long Rest): If the boar takes 10 damage or less that would reduce it to 0 hit points, it is reduced to 1 hit point instead.",,,,,
153,Giant Constrictor Snake,,,,,,,
154,Giant Elk,"Charge: If the elk moves at least 20 ft. straight toward a target and then hits it with a ram Attack on the same turn, the target takes an extra 7 (2d6) damage. If the target is a creature, it must succeed on a DC 14 Strength saving throw or be knocked prone.",,,,,,
155,Gibbering Mouther,Aberrant Ground: The ground in a 10-foot radius around the mouther is doughlike difficult terrain. Each creature that starts its turn in that area must succeed on a DC 10 Strength saving throw or have its speed reduced to 0 until the start of its next turn.,"Gibbering: The mouther babbles incoherently while it can see any creature and isn't Incapacitated. Each creature that starts its turn within 20 feet of the mouther and can hear the gibbering must succeed on a DC 10 Wisdom saving throw. On a failure, the creature can't take reactions until the start of its next turn and rolls a d8 to determine what it does during its turn. On a 1 to 4, the creature does nothing. On a 5 or 6, the creature takes no action or Bonus Action and uses all its Movement to move in a randomly determined direction. On a 7 or 8, the creature makes a melee Attack against a randomly determined creature within its reach or does nothing if it can't make such an Attack.",,,,,
156,Green Dragon Wyrmling,Amphibious: The dragon can breathe air and water.,,,,,,
157,Grick,Stone Camouflage: The grick has advantage on Dexterity (Stealth) checks made to hide in rocky terrain.,,,,,,
158,Griffon,Keen Sight: The griffon has advantage on Wisdom (Perception) checks that rely on sight.,,,,,,
159,Hunter Shark,Blood Frenzy: The shark has advantage on melee Attack rolls against any creature that doesn't have all its hit points.,Water Breathing: The shark can breathe only Underwater.,,,,,
160,Merrow,Amphibious: The merrow can breathe air and water.,,,,,,
161,Mimic,"Shapechanger: The mimic can use its action to Polymorph into an object or back into its true, amorphous form. Its Statistics are the same in each form. Any Equipment it is wearing or carrying isn 't transformed. It reverts to its true form if it dies.",Adhesive (Object Form Only): The mimic adheres to anything that touches it. A Huge or smaller creature adhered to the mimic is also Grappled by it (escape DC 13). Ability Checks made to escape this grapple have disadvantage.,"False Appearance (Object Form Only): While the mimic remains motionless, it is indistinguishable from an ordinary object.",Grappler: The mimic has advantage on Attack rolls against any creature Grappled by it.,,,
162,Minotaur Skeleton,"Charge: If the Skeleton moves at least 10 feet straight toward a target and then hits it with a gore Attack on the same turn, the target takes an extra 9 (2d8) piercing damage. If the target is a creature, it must succeed on a DC 14 Strength saving throw or be pushed up to 10 feet away and knocked prone.",,,,,,
163,Ochre Jelly,Amorphous: The jelly can move through a space as narrow as 1 inch wide without squeezing.,"Spider Climb: The jelly can climb difficult surfaces, including upside down on ceilings, without needing to make an ability check.",,,,,
164,Ogre,,,,,,,
165,Ogre Zombie,"Undead Fortitude: If damage reduces the Zombie to 0 hit points, it must make a Constitution saving throw with a DC of 5+the damage taken, unless the damage is radiant or from a critical hit. On a success, the Zombie drops to 1 hit point instead.",,,,,,
166,Pegasus,,,,,,,
167,Plesiosaurus,Hold Breath: The plesiosaurus can hold its breath for 1 hour.,,,,,,
168,Polar Bear,Keen Smell: The bear has advantage on Wisdom (Perception) checks that rely on smell.,,,,,,
169,Priest,"Divine Eminence: As a Bonus Action, the priest can expend a spell slot to cause its melee weapon attacks to magically deal an extra 10 (3d6) radiant damage to a target on a hit. This benefit lasts until the end of the turn. If the priest expends a spell slot of 2nd level or higher, the extra damage increases by 1d6 for each level above 1st.","Spellcasting: The priest is a 5th-level spellcaster. Its spellcasting ability is Wisdom (spell save DC 13, +5 to hit with spell attacks). The priest has the following Cleric Spells prepared: ",,,,,
170,Rhinoceros,"Charge: If the rhinoceros moves at least 20 ft. straight toward a target and then hits it with a gore Attack on the same turn, the target takes an extra 9 (2d8) bludgeoning damage. If the target is a creature, it must succeed on a DC 15 Strength saving throw or be knocked prone.",,,,,,
171,Rug of Smothering,"Antimagic Susceptibility: The rug is Incapacitated while in the area of an Antimagic Field. If targeted by Dispel Magic, the rug must succeed on a Constitution saving throw against the caster's spell save DC or fall Unconscious for 1 minute.","Damage Transfer: While it is Grappling a creature, the rug takes only half the damage dealt to it, and the creature Grappled by the rug takes the other half.","False Appearance: While the rug remains motionless, it is indistinguishable from a normal rug.",,,,
172,Saber-Toothed Tiger,"
Keen Smell. The tiger has advantage on Wisdom  (Perception) checks that rely on smell. 

","Pounce. If the tiger moves at least 20 feet straight  toward a creature and then hits it with a claw Attack on  the same turn, that target must succeed on a DC 14  Strength saving throw or be knocked prone. If the  target is prone, the tiger can make one bite Attack  against it as a Bonus Action.",,,,,
173,Sea Hag,Amphibious: The hag can breathe air and water.,"Horrific Appearance: Any humanoid that starts its turn within 30 feet of the hag and can see the hag's true form must make a DC 11 Wisdom saving throw. On a failed save, the creature is Frightened for 1 minute. A creature can repeat the saving throw at the end of each of its turns, with disadvantage if the hag is within line of sight, ending the effect on itself on a success. If a creature's saving throw is successful or the effect ends for it, the creature is immune to the hag's Horrific Appearance for the next 24 hours.","Hag Coven: When hags must work together, they form covens, in spite of their selfish natures. A coven is made up of hags of any type, all of whom are equals within the group. However, each of the hags continues to desire more personal power.","Shared Spellcasting (Coven Only): While all three members of a hag coven are within 30 feet of one another, they can each cast the following Spells from the wizard's spell list but must share the Spell Slots among themselves: ","Hag Eye (Coven Only): A hag coven can craft a magic item called a Hag Eye, which is made from a real eye coated in varnish and often fitted to a pendant or other wearable item. The Hag Eye is usually entrusted to a minion for safekeeping and transport. A hag in the coven can take an action to see what the Hag Eye sees if the Hag Eye is on the same plane of existence. A Hag Eye has AC 10, 1 hit point, and Darkvision with a radius of 60 feet. If it is destroyed, each coven member takes 3d10 psychic damage and is Blinded for 24 hours.",,
174,Silver Dragon Wyrmling,,,,,,,
175,Swarm of Poisonous Snakes,"Swarm: The swarm can occupy another creature's space and vice versa, and the swarm can move through any opening large enough for a Tiny snake. The swarm can't regain hit points or gain Temporary Hit Points.",,,,,,
176,Wererat,"Shapechanger: The wererat can use its action to Polymorph into a rat-humanoid hybrid or into a Giant Rat, or back into its true form, which is humanoid. Its Statistics, other than its size, are the same in each form. Any Equipment it is wearing or carrying isn't transformed. It reverts to its true form if it dies.",Keen Smell: The wererat has advantage on Wisdom (Perception) checks that rely on smell.,,,,,
177,White Dragon Wyrmling,,,,,,,
178,Will-o'-Wisp,"Consume Life: As a Bonus Action, the will-o’-wisp can target one creature it can see within 5 feet of it that has 0 hit points and is still alive. The target must succeed on a DC 10 Constitution saving throw against this magic or die. If the target dies, the will-o’-wisp regains 10 (3d6) hit points. ",Ephemeral: The will-o’-wisp can’t wear or carry anything. ,Incorporeal Movement: The will-o’-wisp can move through other creatures and Objects as if they were difficult terrain. It takes 5 (1d10) force damage if it ends its turn inside an object. ,Variable Illumination: The will-o’-wisp sheds bright light in a 5- to 20-foot radius and dim light for an additional number of feet equal to the chosen radius. The will-o’-wisp can alter the radius as a Bonus Action. ,,,
179,Basilisk,"Petrifying Gaze: If a creature starts its turn within 30 ft. of the basilisk and the two of them can see each other, the basilisk can force the creature to make a DC 12 Constitution saving throw if the basilisk isn't Incapacitated. On a failed save, the creature magically begins to turn to stone and is Restrained. It must repeat the saving throw at the end of its next turn. On a success, the effect ends. On a failure, the creature is Petrified until freed by the Greater Restoration spell or other magic.",,,,,,
180,Bearded Devil,Devil's Sight: Magical Darkness doesn't impede the devil's Darkvision.,Magic Resistance: The devil has advantage on saving throws against Spells and other magical effects.,Steadfast: The devil can't be Frightened while it can see an allied creature within 30 feet of it.,,,,
181,Blue Dragon Wyrmling,,,,,,,
182,Doppelganger,"Shapechanger: The doppelganger can use its action to Polymorph into a Small or Medium humanoid it has seen, or back into its true form. Its Statistics, other than its size, are the same in each form. Any Equipment it is wearing or carrying isn't transformed. It reverts to its true form if it dies.","Ambusher: In the first round of a Combat, the doppelganger has advantage on Attack rolls against any creature it has surprised.","Surprise Attack: If the doppelganger surprises a creature and hits it with an Attack during the first round of Combat, the target takes an extra 10 (3d6) damage from the Attack.",,,,
183,Giant Scorpion,,,,,,,
184,Gold Dragon Wyrmling,Amphibious: The dragon can breathe air and water.,,,,,,
185,Green Hag,Amphibious: The hag can breathe air and water.,"Innate Spellcasting: The hag's innate spellcasting ability is Charisma (spell save DC 12). She can innately cast the following Spells, requiring no material components: ",Mimicry: The hag can mimic animal sounds and humanoid voices. A creature that hears the sounds can tell they are imitations with a successful DC 14 Wisdom (Insight) check.,"Hag Coven: When hags must work together, they form covens, in spite of their selfish natures. A coven is made up of hags of any type, all of whom are equals within the group. However, each of the hags continues to desire more personal power.","Shared Spellcasting (Coven Only): While all three members of a hag coven are within 30 feet of one another, they can each cast the following Spells from the wizard's spell list but must share the Spell Slots among themselves: ","Hag Eye (Coven Only): A hag coven can craft a magic item called a Hag Eye, which is made from a real eye coated in varnish and often fitted to a pendant or other wearable item. The Hag Eye is usually entrusted to a minion for safekeeping and transport. A hag in the coven can take an action to see what the Hag Eye sees if the Hag Eye is on the same plane of existence. A Hag Eye has AC 10, 1 hit point, and Darkvision with a radius of 60 feet. If it is destroyed, each coven member takes 3d10 psychic damage and is Blinded for 24 hours.",
186,Hell Hound,Keen Hearing and Smell: The hound has advantage on Wisdom (Perception) checks that rely on hearing or smell.,Pack Tactics: The hound has advantage on an Attack roll against a creature if at least one of the hound's allies is within 5 ft. of the creature and the ally isn't Incapacitated.,,,,,
187,Killer Whale,Echolocation: The whale can't use its blindsight while Deafened.,Hold Breath: The whale can hold its breath for 30 minutes,Keen Hearing: The whale has advantage on Wisdom (Perception) checks that rely on hearing.,,,,
188,Knight,Brave: The knight has advantage on saving throws against being Frightened.,,,,,,
189,Manticore,Tail Spike Regrowth: The manticore has twenty-four tail spikes. Used spikes regrow when the manticore finishes a Long Rest.,,,,,,
190,Minotaur,"Charge: If the minotaur moves at least 10 ft. straight toward a target and then hits it with a gore Attack on the same turn, the target takes an extra 9 (2d8) piercing damage. If the target is a creature, it must succeed on a DC 14 Strength saving throw or be pushed up to 10 ft. away and knocked prone.",Labyrinthine Recall: The minotaur can perfectly recall any path it has traveled.,"Reckless: At the start of its turn, the minotaur can gain advantage on all melee weapon Attack rolls it makes during that turn, but Attack rolls against it have advantage until the start of its next turn.",,,,
191,Mummy,,,,,,,
192,Nightmare,Confer Fire Resistance: The nightmare can grant Resistance to fire damage to anyone riding it.,Illumination: The nightmare sheds bright light in a 10-foot radius and dim light for an additional 10 feet.,,,,,
193,Owlbear,Keen Sight and Smell: The owlbear has advantage on Wisdom (Perception) checks that rely on sight or smell.,,,,,,
194,Phase Spider,"Ethereal Jaunt: As a Bonus Action, the Spider can magically shift from The Material Plane to the Ethereal Plane, or vice versa.","Spider Climb: The Spider can climb difficult surfaces, including upside down on ceilings, without needing to make an ability check.",Web Walker: The Spider ignores Movement restrictions caused by webbing.,,,,
195,Veteran,,,,,,,
196,Werewolf,"Shapechanger: The werewolf can use its action to Polymorph into a wolf-humanoid hybrid or into a wolf, or back into its true form, which is humanoid. Its Statistics, other than its AC, are the same in each form. Any Equipment it is wearing or carrying isn't transformed. It reverts to its true form if it dies.",Keen Hearing and Smell: The werewolf has advantage on Wisdom (Perception) checks that rely on hearing or smell.,,,,,
197,Wight,"Sunlight Sensitivity: While in sunlight, the wight has disadvantage on Attack rolls, as well as on Wisdom (Perception) checks that rely on sight.",,,,,,
198,Winter Wolf,Keen Hearing and Smell: The wolf has advantage on Wisdom (Perception) checks that rely on hearing or smell.,Pack Tactics: The wolf has advantage on an Attack roll against a creature if at least one of the wolf's allies is within 5 ft. of the creature and the ally isn't Incapacitated.,Snow Camouflage: The wolf has advantage on Dexterity (Stealth) checks made to hide in snowy terrain.,,,,
199,Black Pudding,Amorphous: The pudding can move through a space as narrow as 1 inch wide without squeezing.,"Corrosive Form: A creature that touches the pudding or hits it with a melee Attack while within 5 feet of it takes 4 (1d8) acid damage. Any nonmagical weapon made of metal or wood that hits the pudding corrodes. After dealing damage, the weapon takes a permanent and cumulative -1 penalty to Damage Rolls. If its penalty drops to -5, the weapon is destroyed. Nonmagical ammunition made of metal or wood that hits the pudding is destroyed after dealing damage. The pudding can eat through 2-inch-thick, nonmagical wood or metal in 1 round.","Spider Climb: The pudding can climb difficult surfaces, including upside down on ceilings, without needing to make an ability check.",,,,
200,Chuul,Amphibious: The chuul can breathe air and water.,Sense Magic: The chuul senses magic within 120 feet of it at will. This trait otherwise works like the Detect Magic spell but isn't itself magical.,,,,,
201,Couatl,"Innate Spellcasting: The couatl's spellcasting ability is Charisma (spell save DC 14). It can innately cast the following Spells, requiring only verbal components: ",Magic Weapons: The couatl's weapon attacks are magical.,"Shielded Mind: The couatl is immune to Scrying and to any effect that would sense its emotions, read its thoughts, or detect its location.",,,,
202,Elephant,"Trampling Charge: If the elephant moves at least 20 ft. straight toward a creature and then hits it with a gore Attack on the same turn, that target must succeed on a DC 12 Strength saving throw or be knocked prone. If the target is prone, the elephant can make one stomp Attack against it as a Bonus Action.",,,,,,
203,Ettin,"Two Heads: The ettin has advantage on Wisdom (Perception) checks and on saving throws against being Blinded, Charmed, Deafened, Frightened, Stunned, and knocked Unconscious.","Wakeful: When one of the ettin's heads is asleep, its other head is awake.",,,,,
